{
  "id": "void-musl-runit",
  "status": "active",
  "base": "void",
  "libc": "musl",
  "init": "runit",
  "package_manager": "oil",
  "bootstrap_package_manager": "xbps",
  "installer": "oil",
  "composition_model": "oasis-static",
  "paths": {
    "packages": "packages-runtime.txt",
    "packages_dev": "packages-dev.txt",
    "services": "runit",
    "configure_rootfs": "scripts/configure-rootfs.sh",
    "build_rootfs": "scripts/build-rootfs.sh",
    "installer": "../../appliance/scripts/oil-installer.sh"
  },
  "notes": [
    "Oil is the package-manager identity for the composed system.",
    "XBPS is only the Void base bootstrap fetcher until Oil exposes a Void registry backend.",
    "The deployed runtime follows the shared immutable rootfs and state mount contract.",
    "Oasis remains the composition model for reproducible, inspectable system images."
  ]
}
